title,date,views,likes,comments
"SPURS SIGN PERI PERISIC, CONTE BACKED, WE NEED REINFORCEMENTS!! EXPRESSIONS REACTS",2022-06-01T14:13:01Z,61668,3132,388
"LIVERPOOL LOSE TO REAL MADRID IN CHAMPIONS LEAGUE, TROOPZ BLOCKS EXPRESSIONS! 😈Bants Sports OOZ #42",2022-05-31T09:00:06Z,79046,3791,754
EXPRESSIONS LOSES HIS VOICE BUT STILL COOKS DON ROBBIE AND RANTS WINS THE WAR | Bants Sports OOZ #41,2022-05-24T18:00:03Z,121087,5215,929
"SPURS MAKE TOP 4, EX DRINKS ROBBIE AND TROOPZ TEARS, SON 손흥민 WINS GOLDEN BOOT! Norwich 0-5 Tottenham",2022-05-22T18:02:24Z,116176,6956,750
NORWICH 0-5 Tottenham EXPRESSIONS Championship Sunday Live Barstool Philly Bar Presented by Skrill,2022-05-22T17:06:44Z,122524,3769,427
"EXPRESSIONS UNLEASHES ON TROOPZ & ROBBIE, RANTS HAS A MESSAGE FOR ARSENAL FANS! Bants Sports Ooz #40",2022-05-17T15:01:43Z,166638,7878,1602
SPURS TAKE THE TOP 4 BATTLE TO THE FINAL DAY! Tottenham 1-0 Burnley EXPRESSIONS REACTS,2022-05-15T13:54:42Z,57138,2814,307
Tottenham 1-0 Burnley | Premier League LIVE Watch Along with Expressions 토트넘vs번리 손흥민 라이브 축구중계,2022-05-15T13:11:08Z,59225,1898,54
ABSOLUTE SCENES AS SPURS WIN THE NORTH LONDON DERBY!Tottenham 3-0 Arsenal MATCH DAY VLOG EXPRESSIONS,2022-05-12T22:30:55Z,116640,5003,393
50 SHADES OF GREY IN NORTH LONDON!!! Tottenham 3-0 Arsenal EXPRESSIONS REACTS,2022-05-12T21:19:17Z,123019,8144,1184
IT KICKED OFF ONCE AGAIN! Who will get Top 4? Tottenham vs Arsenal COMBINED XI EXPRESSIONS @TroopzTV,2022-05-10T16:36:42Z,131631,6069,923
"BRIGHTON MUNICH STUN UNITED, SPURS RUIN LIVERPOOL’S TITLE CHARGE TOP 4 BATTLE? Bants Sports OOZ #39",2022-05-09T15:15:01Z,63527,2531,795
IS TOP 4 OVER FOR SPURS? CRIMINAL REFEREEING! 🤬 Liverpool 1-1 Tottenham EXPRESSIONS REACTS,2022-05-07T21:27:28Z,79173,3475,533
Liverpool 1-1 Tottenham | Premier League LIVE Watch Along with Expressions,2022-05-07T20:54:50Z,68259,2127,91
Pep Guardiola BOTTLES ANOTHER CHAMPIONS LEAGUE ! Real Madrid 3-1 Man City (6-5)  #shorts,2022-05-04T22:42:48Z,32044,1866,204
#petedavidson ALLEGEDLY GETS A TATTOO OF #kanyewest KIDS #shorts,2022-05-02T14:49:27Z,20600,995,42
THE FOXES HUNTED! THE TOP 4 HUNT IS STILL ON!! Tottenham 3-1 Leicester EXPRESSIONS REACTS,2022-05-01T15:36:55Z,43378,1953,228
손흥민 SONSATIONAL PERFORMANCE! Tottenham 3-1 Leicester | LIVE Watch Along with Expressions,2022-05-01T15:00:41Z,61517,1869,85
"SPURS STUNG BY THE BEES’S 😑 MAN UNITED’S TOP 4 HOPES UP IN SMOKE, CONTE TO PSG? Bants Sports OOZ #37",2022-04-25T15:02:29Z,77503,3007,730
TYSON FURY VS DILLIAN WHYTE LIVE AT WEMBLEY | with Expressions & @Rants N Bants,2022-04-24T07:29:16Z,28901,1144,159
TOP 4 HOPES STUNG BY THE BEES! SHOCKING PERFORMANCE | Brentford 0-0 Tottenham EXPRESSIONS REACTS,2022-04-23T18:59:04Z,102699,4110,710
Brentford 0-0 Tottenham | Premier League LIVE Watch Along with Expressions,2022-04-23T18:31:34Z,70301,1785,189
NORTH LONDON PUT IN A SPLIFF WHILE RONALDO RUNS RIOT! Bants Sports OOZ #36,2022-04-18T14:37:32Z,62320,2516,887
90 MINUTES OF MY LIFE I WILL NEVER GET BACK 🤬 Tottenham 0-1 Brighton MATCHDAY VLOG,2022-04-16T15:59:49Z,40803,1348,255
EMBARRASSING! SPURS GIVE ME HOPE JUST TO TAKE IT AWAY! 🤬 Tottenham 0-1 Brighton EXPRESSIONS REACTS,2022-04-16T14:09:12Z,89327,3744,585
Did A$AP Rocky cheat on RIHANNA? #shorts,2022-04-15T17:58:11Z,24981,1046,34
CHAMPIONS LEAGUE BRAWL!!! - Atletico Madrid vs Manchester City #shorts,2022-04-14T14:12:04Z,25032,1358,53
"SPURS CONNECT 4, UNITED OUT OF TOP 4 RACE?, ASSNA IN A NORTH LONDON SPLIFF! Bants Sports OOZ #35",2022-04-11T16:56:07Z,73083,3304,478
SON SHINES AS SPURS CONNECT 4 ASSNA IN A SPLIFF AGAIN! Aston Villa 0-4 Tottenham EXPRESSIONS REACTS,2022-04-09T19:41:51Z,84823,5043,586
HEUNG MIN SON 손흥민 DESTROYS VILLA! Aston Villa 0-4 Tottenham | LIVE Watch Along with Expressions,2022-04-09T19:00:28Z,92327,3181,253
"PATRICK VIAGRA DESTROYS ARSENAL, CHELSEA IN A SPLIFF, UNITED DRAW, SPURS TOP 4! Bants Sports OOZ #34",2022-04-05T14:50:08Z,72827,2827,548
WWE Wrestlemania 38 | LIVE Day 2 Watch Along With Expressions ft @Rants N Bants ​,2022-04-04T04:12:38Z,41861,1556,25
TOP 4 AND ABOVE THE ARSE LIKE A LOWER BACK! Tottenham 5-1 Newcastle EXPRESSIONS REACTS,2022-04-03T18:08:03Z,58959,3017,390
Tottenham 5-1 Newcastle | Premier League LIVE Watch Along with Expressions,2022-04-03T17:43:40Z,67013,2118,119
WWE Wrestlemania 38 | LIVE Day 1 Watch Along With Expressions ft @Rants N Bants ​,2022-04-03T04:31:39Z,42114,1589,72
"WILL SMITH VS CHRIS ROCK AT THE OSCARS, HARRY MAGUIRE BOO’D, THE PREM IS BACK!! Bants Sports OOZ #33",2022-03-31T18:49:40Z,75476,3646,548
CHRIS ROCK SLAPPED BY WILL SMITH @ THE OSCARS #shorts #oscars2022 #willsmith,2022-03-28T14:28:24Z,33180,1493,107
"UNITED OUT OF EUROPE, SPURS OR ARSENAL FOR TOP 4, EL CLASSICO, POCH IN TROUBLE? BANTS SPORTS OOZ #32",2022-03-21T16:16:13Z,75990,2868,411
HEUNG MIN SON 손흥민 DESTROYS THE HAMMERS! Tottenham 3-1 West Ham EXPRESSIONS VLOG,2022-03-20T20:26:33Z,49959,2203,172
WEST HAM PUT IN A SPLIFF AND CAT LIVES MATTER FOR ZOUMA | Tottenham 3-1 West Ham EXPRESSIONS REACTS,2022-03-20T19:19:18Z,51844,2937,240
EXPRESSIONS STORE AND MERCH IS OUT NOW!!!,2022-03-18T11:52:43Z,11742,743,98
HARRY MAGUIRE BEING SELECTED FOR ENGLAND IS FOOTBALLING ILLUMINATI🤔 #shorts,2022-03-17T18:04:37Z,54275,2788,181
THE WIN LOSE RECORD CONTINUES TOP 4? Brighton 0-2 Tottenham MATCH REACTION with EXPRESSIONS,2022-03-16T22:16:35Z,36512,1824,220
Brighton 0-2 Tottenham | Premier League LIVE Watch Along with Expressions,2022-03-16T21:34:31Z,44214,1258,23
"PETE DAVIDSON ""IM IN BED WITH YOUR WIFE"" #petedavidson #kanyewest",2022-03-14T22:44:22Z,312793,5851,264
"EX AND RANTS CLASH OVER RONALDO, TOP 4 ASSNA, CHELSCUM IN FINANCIAL TURMOIL | BANTS SPORTS OOZ #31",2022-03-14T16:35:20Z,88800,3898,1220
RONALDO RUNS RIOT AND SPURS LOSE AGAIN! 🤬 Manchester United 3-2 Tottenham EXPRESSIONS REACTS,2022-03-12T20:07:56Z,178873,7524,1086
Manchester United 3-2 Tottenham | Premier League LIVE Watch Along with Expressions,2022-03-12T19:35:31Z,165089,4117,484
"MAN UNITED EMBARRASSED IN DERBY, LAMPARD TO RELEGATE EVERTON? Bants Sports OOZ #30",2022-03-08T16:41:33Z,69676,2792,458
"FRANK LAMPARD PUT IN A SPLIFF, SACKED IN THE MORNING! Tottenham 5-0 Everton EXPRESSIONS REACTS",2022-03-07T22:34:32Z,71547,3491,372
Tottenham 5-0 Everton | Premier League LIVE Watch Along with Expressions,2022-03-07T22:04:44Z,70670,2177,51
TOTTENHAM OUT OF THE FA CUP ON MY BIRTHDAY 🤬🤬 Middlesbrough 1-0 Tottenham EXPRESSIONS REACTS,2022-03-01T23:05:44Z,182312,9164,1468
Middlesbrough 1-0 Tottenham | FA Cup LIVE Watch Along with Expressions,2022-03-01T22:41:11Z,129141,3808,432
KEPA COSTS CHELSEA THE CUP & CR7 IS IT TIME TO RETIRE? Bants Sports OOZ #29,2022-02-28T15:14:06Z,66556,2737,568
LEEDS PUT IN A SPLIFF THEY COULD BE RELEGATED!!  Leeds 0-4 Tottenham EXPRESSIONS REACTS,2022-02-26T15:43:10Z,48499,2339,247
Leeds 0-4 Tottenham | LIVE Watch Along With Expressions,2022-02-26T14:31:24Z,69333,2161,44
ANTONIO CONTE LOSES IT IN POST MATCH INTERVIEW! WILL HE LEAVE TOTTENHAM? EXPRESSIONS REACTS,2022-02-24T14:48:46Z,104855,4405,590
WHAT AN ABSOLUTE JOKE!! 🤬 Burnley 1-0 Tottenham EXPRESSIONS REACTS,2022-02-23T21:59:02Z,152928,6047,1015
Burnley 1-0 Tottenham | LIVE Watch Along With Expressions,2022-02-23T21:42:45Z,85421,2404,212
"SPURS BEAT CITY, FODEN'S MUM VS SCOUSERS & EX MEETS AMY DAY FROM LOVE ISLAND! Bants Sports OOZ #28",2022-02-21T16:55:53Z,78804,3067,516
Amir Khan vs Kell Brook | LIVE Bants Sports OOZ Watch Along ft Expressions and Rants,2022-02-19T23:42:11Z,63757,1855,49
CITEHHH TURNED OVER AT HOME!!! Manchester City 2-3 Tottenham EXPRESSIONS REACTS,2022-02-19T20:31:00Z,133685,7062,700
Manchester City 2-3 Tottenham | LIVE Watch Along With Expressions,2022-02-19T19:47:02Z,201928,7166,471
THIS COULD BE A PREMIER LEAGUE FUNERAL! MANCHESTER CITY VS TOTTENHAM - Match Preview @Big Steve Mcfc,2022-02-18T12:00:15Z,57012,2833,326
"SPURS LOSE AGAIN, RONALDO IS FINISHED? THOUGHTS ON SUPERBOWL - Bants Sports OOZ #27",2022-02-14T15:21:26Z,90544,3616,656
IM SEETHING AFTER THAT PERFORMANCE 🤬 Tottenham 0-2 Wolves MATCHDAY VLOG,2022-02-13T18:27:40Z,91015,2920,448
TOP 4 IS DONE I'VE HAD ENOUGH OF BELIEVING! - Tottenham 0-2 Wolves EXPRESSIONS REACTS,2022-02-13T16:40:07Z,172198,7762,1259
DOMINATED 50 SHADES OF SOUTHAMPTON IM FUMING! 🤬 Tottenham 2-3 Southampton EXPRESSIONS REACTS,2022-02-09T22:19:37Z,137655,5734,794
Tottenham 2-3 Southampton | LIVE Watch Along With Expressions,2022-02-09T21:57:26Z,109947,3364,496
"UNITED CRASH OUT THE FA CUP, MARC OVERMARS & FOXES GET FED!! Bants Sports OOZ #26",2022-02-07T15:41:07Z,56401,2445,484
CHAMPAGNE FOOTBALL IS BACK!!! Tottenham 3-1 Brighton EXPRESSIONS REACTS,2022-02-05T22:43:00Z,45905,2333,224
Tottenham 3-1 Brighton FA CUP | LIVE Watch Along With Expressions,2022-02-05T22:18:24Z,44536,1512,51
THE ITALIAN JOB BEGINS? AUBAMEYANG LEAVES & GREENWOOD SUSPENDED! @Aba & Preach Bants Sports OOZ #25,2022-02-01T19:25:09Z,110269,4905,822
WWE Royal Rumble 2022 | LIVE Watch Along With Expressions ft @Rants N Bants,2022-01-30T05:34:00Z,65184,2075,105
ANOTHER SHOCKING TRANSFER WINDOW FOR SPURS! 🤬 WILL CONTE WALK? TRAORE DEAL OFF! EXPRESSIONS REACTS,2022-01-27T16:40:06Z,87685,3598,689
"SPURS LOSE TO CHELSEA AGAIN, ROLEX RALPH BACK, ARSENAL OUT 2 CUPS IN 2 WEEKS! Bants Sports OOZ #24",2022-01-24T19:23:39Z,66050,2549,449
"IM TIRED OF PLAYING CHELSEA NOW, WE NEVER WIN! Chelsea 2-0 Tottenham EXPRESSIONS REACTS",2022-01-23T19:18:40Z,112439,5086,630
Chelsea 2-0 Tottenham | LIVE Watch Along With Expressions,2022-01-23T18:34:22Z,98860,2947,185
BLACK GREALISH STEVIE WONDER TO THE RESCUE!!! Leicester 2-3 Tottenham EXPRESSIONS REACTS,2022-01-19T22:14:50Z,88676,4878,392
Leicester 2-3 Tottenham | LIVE Watch Along With Expressions,2022-01-19T21:55:20Z,177244,6407,576
ARSENAL GET THE NLD POSTPONED 😭 AND CR7 RIPS UNITED PLAYERS MENTALITY! Bants Sports OOZ #23,2022-01-17T18:03:41Z,70425,2595,581
THE NORTH LONDON DERBY IS HERE! TOTTENHAM VS ARSENAL - Expressions vs @TroopzTV,2022-01-14T12:00:12Z,112564,5360,589
WE ARE OUT OF THE CUP!!! 😡😡😡 | Tottenham 0-1 Chelsea MATCH DAY VLOG with EXPRESSIONS,2022-01-13T00:43:44Z,49461,1913,224
OUT THE CARABAO CUP 🤬Tottenham 0-1 Chelsea (0-3) MATCH REACTION with EXPRESSIONS,2022-01-12T23:02:39Z,99145,5348,629
"ASSNA OUT OF THE FA CUP, EXPRESSIONS AND RANTS WANT PLAYERS OUT!!! - Bants Sports OOZ #22",2022-01-10T16:06:36Z,57189,2389,414
ABSOLUTELY DISGRACEFUL IM FUMING! 🤬 Chelsea 2-0 Tottenham - Carabao Cup | EXPRESSIONS REACTS,2022-01-05T22:12:37Z,127626,6037,830
DISGRACEFUL PERFORMANCE! 🤬Chelsea 2-0 Tottenham - Carabao Cup | LIVE Watch Along With Expressions,2022-01-05T21:45:52Z,103230,2878,203
"WRECK IT RALF AT THE WHEEL, VAR-SENAL ROBBED? 🤣 LUKAKU WANTS OUT! Bants Sports OOZ #21",2022-01-04T15:14:53Z,67467,2933,780
3 POINTS BUT CONTE NEEDS SOME NEW PLAYERS IMMEDIATELY!!! Watford 0-1 Tottenham | EXPRESSIONS REACTS,2022-01-01T18:16:53Z,45607,2203,234
Watford 0-1 Tottenham | LIVE Watch Along With Expressions,2022-01-01T17:11:57Z,80944,2378,130
