title,date,views,likes,comments,team_score,opponent_score
"BRIGHTON MUNICH STUN UNITED, SPURS RUIN LIVERPOOL’S TITLE CHARGE TOP 4 BATTLE? Bants Sports OOZ #39",2022-05-09,63527,2531,795,,
IS TOP 4 OVER FOR SPURS? CRIMINAL REFEREEING! 🤬 Liverpool 1-1 Tottenham EXPRESSIONS REACTS,2022-05-07,79173,3475,533,1.0,1.0
Liverpool 1-1 Tottenham | Premier League LIVE Watch Along with Expressions,2022-05-07,68259,2127,91,1.0,1.0
Pep Guardiola BOTTLES ANOTHER CHAMPIONS LEAGUE ! Real Madrid 3-1 Man City (6-5)  #shorts,2022-05-04,32044,1866,204,1.0,3.0
#petedavidson ALLEGEDLY GETS A TATTOO OF #kanyewest KIDS #shorts,2022-05-02,20600,995,42,,
THE FOXES HUNTED! THE TOP 4 HUNT IS STILL ON!! Tottenham 3-1 Leicester EXPRESSIONS REACTS,2022-05-01,43378,1953,228,3.0,1.0
손흥민 SONSATIONAL PERFORMANCE! Tottenham 3-1 Leicester | LIVE Watch Along with Expressions,2022-05-01,61517,1869,85,3.0,1.0
"SPURS STUNG BY THE BEES’S 😑 MAN UNITED’S TOP 4 HOPES UP IN SMOKE, CONTE TO PSG? Bants Sports OOZ #37",2022-04-25,77503,3007,730,,
TYSON FURY VS DILLIAN WHYTE LIVE AT WEMBLEY | with Expressions & @Rants N Bants,2022-04-24,28901,1144,159,,
TOP 4 HOPES STUNG BY THE BEES! SHOCKING PERFORMANCE | Brentford 0-0 Tottenham EXPRESSIONS REACTS,2022-04-23,102699,4110,710,0.0,0.0
Brentford 0-0 Tottenham | Premier League LIVE Watch Along with Expressions,2022-04-23,70301,1785,189,0.0,0.0
NORTH LONDON PUT IN A SPLIFF WHILE RONALDO RUNS RIOT! Bants Sports OOZ #36,2022-04-18,62320,2516,887,,
90 MINUTES OF MY LIFE I WILL NEVER GET BACK 🤬 Tottenham 0-1 Brighton MATCHDAY VLOG,2022-04-16,40803,1348,255,0.0,1.0
EMBARRASSING! SPURS GIVE ME HOPE JUST TO TAKE IT AWAY! 🤬 Tottenham 0-1 Brighton EXPRESSIONS REACTS,2022-04-16,89327,3744,585,0.0,1.0
Did A$AP Rocky cheat on RIHANNA? #shorts,2022-04-15,24981,1046,34,,
CHAMPIONS LEAGUE BRAWL!!! - Atletico Madrid vs Manchester City #shorts,2022-04-14,25032,1358,53,,
"SPURS CONNECT 4, UNITED OUT OF TOP 4 RACE?, ASSNA IN A NORTH LONDON SPLIFF! Bants Sports OOZ #35",2022-04-11,73083,3304,478,,
SON SHINES AS SPURS CONNECT 4 ASSNA IN A SPLIFF AGAIN! Aston Villa 0-4 Tottenham EXPRESSIONS REACTS,2022-04-09,84823,5043,586,4.0,0.0
HEUNG MIN SON 손흥민 DESTROYS VILLA! Aston Villa 0-4 Tottenham | LIVE Watch Along with Expressions,2022-04-09,92327,3181,253,4.0,0.0
"PATRICK VIAGRA DESTROYS ARSENAL, CHELSEA IN A SPLIFF, UNITED DRAW, SPURS TOP 4! Bants Sports OOZ #34",2022-04-05,72827,2827,548,,
WWE Wrestlemania 38 | LIVE Day 2 Watch Along With Expressions ft @Rants N Bants ​,2022-04-04,41861,1556,25,,
TOP 4 AND ABOVE THE ARSE LIKE A LOWER BACK! Tottenham 5-1 Newcastle EXPRESSIONS REACTS,2022-04-03,58959,3017,390,5.0,1.0
Tottenham 5-1 Newcastle | Premier League LIVE Watch Along with Expressions,2022-04-03,67013,2118,119,5.0,1.0
WWE Wrestlemania 38 | LIVE Day 1 Watch Along With Expressions ft @Rants N Bants ​,2022-04-03,42114,1589,72,,
"WILL SMITH VS CHRIS ROCK AT THE OSCARS, HARRY MAGUIRE BOO’D, THE PREM IS BACK!! Bants Sports OOZ #33",2022-03-31,75476,3646,548,,
CHRIS ROCK SLAPPED BY WILL SMITH @ THE OSCARS #shorts #oscars2022 #willsmith,2022-03-28,33180,1493,107,,
"UNITED OUT OF EUROPE, SPURS OR ARSENAL FOR TOP 4, EL CLASSICO, POCH IN TROUBLE? BANTS SPORTS OOZ #32",2022-03-21,75990,2868,411,,
HEUNG MIN SON 손흥민 DESTROYS THE HAMMERS! Tottenham 3-1 West Ham EXPRESSIONS VLOG,2022-03-20,49959,2203,172,3.0,1.0
WEST HAM PUT IN A SPLIFF AND CAT LIVES MATTER FOR ZOUMA | Tottenham 3-1 West Ham EXPRESSIONS REACTS,2022-03-20,51844,2937,240,3.0,1.0
EXPRESSIONS STORE AND MERCH IS OUT NOW!!!,2022-03-18,11742,743,98,,
HARRY MAGUIRE BEING SELECTED FOR ENGLAND IS FOOTBALLING ILLUMINATI🤔 #shorts,2022-03-17,54275,2788,181,,
THE WIN LOSE RECORD CONTINUES TOP 4? Brighton 0-2 Tottenham MATCH REACTION with EXPRESSIONS,2022-03-16,36512,1824,220,2.0,0.0
Brighton 0-2 Tottenham | Premier League LIVE Watch Along with Expressions,2022-03-16,44214,1258,23,2.0,0.0
"PETE DAVIDSON ""IM IN BED WITH YOUR WIFE"" #petedavidson #kanyewest",2022-03-14,312793,5851,264,,
"EX AND RANTS CLASH OVER RONALDO, TOP 4 ASSNA, CHELSCUM IN FINANCIAL TURMOIL | BANTS SPORTS OOZ #31",2022-03-14,88800,3898,1220,,
RONALDO RUNS RIOT AND SPURS LOSE AGAIN! 🤬 Manchester United 3-2 Tottenham EXPRESSIONS REACTS,2022-03-12,178873,7524,1086,2.0,3.0
Manchester United 3-2 Tottenham | Premier League LIVE Watch Along with Expressions,2022-03-12,165089,4117,484,2.0,3.0
"MAN UNITED EMBARRASSED IN DERBY, LAMPARD TO RELEGATE EVERTON? Bants Sports OOZ #30",2022-03-08,69676,2792,458,,
"FRANK LAMPARD PUT IN A SPLIFF, SACKED IN THE MORNING! Tottenham 5-0 Everton EXPRESSIONS REACTS",2022-03-07,71547,3491,372,5.0,0.0
Tottenham 5-0 Everton | Premier League LIVE Watch Along with Expressions,2022-03-07,70670,2177,51,5.0,0.0
TOTTENHAM OUT OF THE FA CUP ON MY BIRTHDAY 🤬🤬 Middlesbrough 1-0 Tottenham EXPRESSIONS REACTS,2022-03-01,182312,9164,1468,0.0,1.0
Middlesbrough 1-0 Tottenham | FA Cup LIVE Watch Along with Expressions,2022-03-01,129141,3808,432,0.0,1.0
KEPA COSTS CHELSEA THE CUP & CR7 IS IT TIME TO RETIRE? Bants Sports OOZ #29,2022-02-28,66556,2737,568,,
LEEDS PUT IN A SPLIFF THEY COULD BE RELEGATED!!  Leeds 0-4 Tottenham EXPRESSIONS REACTS,2022-02-26,48499,2339,247,4.0,0.0
Leeds 0-4 Tottenham | LIVE Watch Along With Expressions,2022-02-26,69333,2161,44,4.0,0.0
ANTONIO CONTE LOSES IT IN POST MATCH INTERVIEW! WILL HE LEAVE TOTTENHAM? EXPRESSIONS REACTS,2022-02-24,104855,4405,590,,
WHAT AN ABSOLUTE JOKE!! 🤬 Burnley 1-0 Tottenham EXPRESSIONS REACTS,2022-02-23,152928,6047,1015,0.0,1.0
Burnley 1-0 Tottenham | LIVE Watch Along With Expressions,2022-02-23,85421,2404,212,0.0,1.0
"SPURS BEAT CITY, FODEN'S MUM VS SCOUSERS & EX MEETS AMY DAY FROM LOVE ISLAND! Bants Sports OOZ #28",2022-02-21,78804,3067,516,,
Amir Khan vs Kell Brook | LIVE Bants Sports OOZ Watch Along ft Expressions and Rants,2022-02-19,63757,1855,49,,
CITEHHH TURNED OVER AT HOME!!! Manchester City 2-3 Tottenham EXPRESSIONS REACTS,2022-02-19,133685,7062,700,3.0,2.0
Manchester City 2-3 Tottenham | LIVE Watch Along With Expressions,2022-02-19,201928,7166,471,3.0,2.0
THIS COULD BE A PREMIER LEAGUE FUNERAL! MANCHESTER CITY VS TOTTENHAM - Match Preview @Big Steve Mcfc,2022-02-18,57012,2833,326,,
"SPURS LOSE AGAIN, RONALDO IS FINISHED? THOUGHTS ON SUPERBOWL - Bants Sports OOZ #27",2022-02-14,90544,3616,656,,
IM SEETHING AFTER THAT PERFORMANCE 🤬 Tottenham 0-2 Wolves MATCHDAY VLOG,2022-02-13,91015,2920,448,0.0,2.0
TOP 4 IS DONE I'VE HAD ENOUGH OF BELIEVING! - Tottenham 0-2 Wolves EXPRESSIONS REACTS,2022-02-13,172198,7762,1259,0.0,2.0
DOMINATED 50 SHADES OF SOUTHAMPTON IM FUMING! 🤬 Tottenham 2-3 Southampton EXPRESSIONS REACTS,2022-02-09,137655,5734,794,2.0,3.0
Tottenham 2-3 Southampton | LIVE Watch Along With Expressions,2022-02-09,109947,3364,496,2.0,3.0
"UNITED CRASH OUT THE FA CUP, MARC OVERMARS & FOXES GET FED!! Bants Sports OOZ #26",2022-02-07,56401,2445,484,,
CHAMPAGNE FOOTBALL IS BACK!!! Tottenham 3-1 Brighton EXPRESSIONS REACTS,2022-02-05,45905,2333,224,3.0,1.0
Tottenham 3-1 Brighton FA CUP | LIVE Watch Along With Expressions,2022-02-05,44536,1512,51,3.0,1.0
THE ITALIAN JOB BEGINS? AUBAMEYANG LEAVES & GREENWOOD SUSPENDED! @Aba & Preach Bants Sports OOZ #25,2022-02-01,110269,4905,822,,
WWE Royal Rumble 2022 | LIVE Watch Along With Expressions ft @Rants N Bants,2022-01-30,65184,2075,105,,
ANOTHER SHOCKING TRANSFER WINDOW FOR SPURS! 🤬 WILL CONTE WALK? TRAORE DEAL OFF! EXPRESSIONS REACTS,2022-01-27,87685,3598,689,,
"SPURS LOSE TO CHELSEA AGAIN, ROLEX RALPH BACK, ARSENAL OUT 2 CUPS IN 2 WEEKS! Bants Sports OOZ #24",2022-01-24,66050,2549,449,,
"IM TIRED OF PLAYING CHELSEA NOW, WE NEVER WIN! Chelsea 2-0 Tottenham EXPRESSIONS REACTS",2022-01-23,112439,5086,630,0.0,2.0
Chelsea 2-0 Tottenham | LIVE Watch Along With Expressions,2022-01-23,98860,2947,185,0.0,2.0
BLACK GREALISH STEVIE WONDER TO THE RESCUE!!! Leicester 2-3 Tottenham EXPRESSIONS REACTS,2022-01-19,88676,4878,392,3.0,2.0
Leicester 2-3 Tottenham | LIVE Watch Along With Expressions,2022-01-19,177244,6407,576,3.0,2.0
ARSENAL GET THE NLD POSTPONED 😭 AND CR7 RIPS UNITED PLAYERS MENTALITY! Bants Sports OOZ #23,2022-01-17,70425,2595,581,,
THE NORTH LONDON DERBY IS HERE! TOTTENHAM VS ARSENAL - Expressions vs @TroopzTV,2022-01-14,112564,5360,589,,
WE ARE OUT OF THE CUP!!! 😡😡😡 | Tottenham 0-1 Chelsea MATCH DAY VLOG with EXPRESSIONS,2022-01-13,49461,1913,224,0.0,1.0
OUT THE CARABAO CUP 🤬Tottenham 0-1 Chelsea (0-3) MATCH REACTION with EXPRESSIONS,2022-01-12,99145,5348,629,0.0,1.0
"ASSNA OUT OF THE FA CUP, EXPRESSIONS AND RANTS WANT PLAYERS OUT!!! - Bants Sports OOZ #22",2022-01-10,57189,2389,414,,
ABSOLUTELY DISGRACEFUL IM FUMING! 🤬 Chelsea 2-0 Tottenham - Carabao Cup | EXPRESSIONS REACTS,2022-01-05,127626,6037,830,0.0,2.0
DISGRACEFUL PERFORMANCE! 🤬Chelsea 2-0 Tottenham - Carabao Cup | LIVE Watch Along With Expressions,2022-01-05,103230,2878,203,0.0,2.0
"WRECK IT RALF AT THE WHEEL, VAR-SENAL ROBBED? 🤣 LUKAKU WANTS OUT! Bants Sports OOZ #21",2022-01-04,67467,2933,780,,
3 POINTS BUT CONTE NEEDS SOME NEW PLAYERS IMMEDIATELY!!! Watford 0-1 Tottenham | EXPRESSIONS REACTS,2022-01-01,45607,2203,234,1.0,0.0
Watford 0-1 Tottenham | LIVE Watch Along With Expressions,2022-01-01,80944,2378,130,1.0,0.0
